{
  "$schema": "https://json-schema.org/draft/2020-12/schema",
  "$id": "https://ripple.example/contracts/source_changed.v1.schema.json",
  "title": "SourceChanged v1 (FUTURE connector envelope, not implemented in W1)",
  "description": "Envelope a future, authenticated connector gateway would deliver when a registered source changed. NOT implemented: Ripple W1 ships manual refresh (/v2/sources/refresh/*). Structural half only; duplicate paths, path traversal and the revision chain are checked by core/change_intelligence/v2/source_changed.py.",
  "type": "object",
  "additionalProperties": false,
  "required": ["schema_version", "event_id", "connector", "tenant_id", "project_id", "workspace_id",
               "registered_source_id", "previous_revision", "next_revision", "changed_manifest",
               "occurred_at", "auth_provenance"],
  "properties": {
    "schema_version": {"type": "string", "enum": ["source_changed.v1"]},
    "event_id": {"$ref": "#/$defs/id"},
    "connector": {
      "type": "object",
      "additionalProperties": false,
      "required": ["connector_id", "kind"],
      "properties": {
        "connector_id": {"$ref": "#/$defs/id"},
        "kind": {"type": "string", "enum": ["git", "manual", "object_store"]}
      }
    },
    "tenant_id": {"$ref": "#/$defs/id"},
    "project_id": {"$ref": "#/$defs/id"},
    "workspace_id": {"$ref": "#/$defs/id"},
    "registered_source_id": {"$ref": "#/$defs/id"},
    "previous_revision": {"oneOf": [{"type": "null"}, {"$ref": "#/$defs/revision"}]},
    "next_revision": {"$ref": "#/$defs/revision"},
    "git": {
      "type": "object",
      "additionalProperties": false,
      "required": ["commit", "ref"],
      "properties": {
        "commit": {"$ref": "#/$defs/revision"},
        "ref": {"$ref": "#/$defs/revision"}
      }
    },
    "changed_manifest": {
      "type": "array",
      "minItems": 1,
      "maxItems": 5000,
      "items": {
        "type": "object",
        "additionalProperties": false,
        "required": ["path", "change"],
        "properties": {
          "path": {"type": "string", "minLength": 1, "maxLength": 1024},
          "change": {"type": "string", "enum": ["added", "modified", "deleted", "renamed"]},
          "sha256": {"type": "string", "pattern": "^sha256:[0-9a-f]{64}$"},
          "byte_size": {"type": "integer", "minimum": 0},
          "previous_path": {"type": "string", "minLength": 1, "maxLength": 1024}
        },
        "allOf": [
          {"if": {"properties": {"change": {"enum": ["added", "modified", "renamed"]}}, "required": ["change"]},
           "then": {"required": ["sha256", "byte_size"]}},
          {"if": {"properties": {"change": {"const": "renamed"}}, "required": ["change"]},
           "then": {"required": ["previous_path"]}},
          {"if": {"properties": {"change": {"enum": ["added", "modified"]}}, "required": ["change"]},
           "then": {"not": {"required": ["previous_path"]}}},
          {"if": {"properties": {"change": {"const": "deleted"}}, "required": ["change"]},
           "then": {"not": {"anyOf": [{"required": ["sha256"]}, {"required": ["byte_size"]},
                                      {"required": ["previous_path"]}]}}}
        ]
      }
    },
    "occurred_at": {"type": "string", "pattern": "^\\d{4}-\\d{2}-\\d{2}T\\d{2}:\\d{2}:\\d{2}(\\.\\d{1,9})?Z$"},
    "auth_provenance": {
      "type": "object",
      "additionalProperties": false,
      "required": ["method", "key_id", "verified_by", "verified_at"],
      "properties": {
        "method": {"$ref": "#/$defs/id"},
        "key_id": {"$ref": "#/$defs/id"},
        "verified_by": {"type": "string", "enum": ["connector_gateway"]},
        "verified_at": {"type": "string", "pattern": "^\\d{4}-\\d{2}-\\d{2}T\\d{2}:\\d{2}:\\d{2}(\\.\\d{1,9})?Z$"}
      }
    }
  },
  "allOf": [
    {"if": {"properties": {"connector": {"properties": {"kind": {"const": "git"}}, "required": ["kind"]}},
            "required": ["connector"]},
     "then": {"required": ["git"]},
     "else": {"not": {"required": ["git"]}}}
  ],
  "$defs": {
    "id": {"type": "string", "minLength": 1, "maxLength": 128},
    "revision": {"type": "string", "minLength": 1, "maxLength": 256}
  }
}
