{
  "schema_version": "source_changed.v1",
  "event_id": "evt-0002",
  "connector": {
    "connector_id": "conn-manual-1",
    "kind": "manual"
  },
  "tenant_id": "tenant-acme",
  "project_id": "project-harbor",
  "workspace_id": "workspace-harbor",
  "registered_source_id": "regsrc-harbor-repo",
  "previous_revision": null,
  "next_revision": "manual-2026-09-30-1",
  "changed_manifest": [
    {
      "path": "data/matrix.xlsx",
      "change": "modified",
      "sha256": "sha256:aaaaaaaaaaaaaaaaaaaaaaaaaaaaaaaaaaaaaaaaaaaaaaaaaaaaaaaaaaaaaaaa",
      "byte_size": 9001
    }
  ],
  "occurred_at": "2026-09-30T08:15:00Z",
  "auth_provenance": {
    "method": "oauth_app",
    "key_id": "app-42",
    "verified_by": "connector_gateway",
    "verified_at": "2026-09-30T08:16:00Z"
  }
}
